Parsed test spec with 3 sessions

starting permutation: s1_begin s1_snap s2_update s2_vacuum s1_snap s1_commit s3_seq
step s1_begin: BEGIN;
step s1_snap: SELECT id, v FROM hib WHERE v = 400;
id|  v
--+---
 1|400
(1 row)

step s2_update: UPDATE hib SET v = 500 WHERE id = 1;
step s2_vacuum: VACUUM (INDEX_CLEANUP off) hib;
step s1_snap: SELECT id, v FROM hib WHERE v = 400;
id|v
--+-
(0 rows)

step s1_commit: COMMIT;
step s3_seq: SELECT id, v FROM hib ORDER BY id;
id|  v
--+---
 1|500
 2| 20
 3| 30
 4| 40
 5| 50
(5 rows)


starting permutation: s1_begin s2_update s1_snap s2_vacuum s1_snap s1_commit s3_seq
step s1_begin: BEGIN;
step s2_update: UPDATE hib SET v = 500 WHERE id = 1;
step s1_snap: SELECT id, v FROM hib WHERE v = 400;
id|v
--+-
(0 rows)

step s2_vacuum: VACUUM (INDEX_CLEANUP off) hib;
step s1_snap: SELECT id, v FROM hib WHERE v = 400;
id|v
--+-
(0 rows)

step s1_commit: COMMIT;
step s3_seq: SELECT id, v FROM hib ORDER BY id;
id|  v
--+---
 1|500
 2| 20
 3| 30
 4| 40
 5| 50
(5 rows)

