unused step name: s1ra
Parsed test spec with 3 sessions

starting permutation: s1r1 s2u s2c s1r2 s1c
step s1r1: SELECT value FROM recno_rc_test WHERE id = 1;
value
-----
   10
(1 row)

step s2u: UPDATE recno_rc_test SET value = value + 10 WHERE id = 1;
step s2c: COMMIT;
step s1r2: SELECT value FROM recno_rc_test WHERE id = 1;
value
-----
(0 rows)

step s1c: COMMIT;

starting permutation: s1u s2u s1c s2c
s3: WARNING:  there is already a transaction in progress
step s1u: UPDATE recno_rc_test SET value = value + 1 WHERE id = 1;
step s2u: UPDATE recno_rc_test SET value = value + 10 WHERE id = 1;
step s1c: COMMIT;
step s2c: COMMIT;

starting permutation: s1r1 s2u s1r1 s2c s1r2 s1c
s3: WARNING:  there is already a transaction in progress
step s1r1: SELECT value FROM recno_rc_test WHERE id = 1;
value
-----
   10
(1 row)

step s2u: UPDATE recno_rc_test SET value = value + 10 WHERE id = 1;
step s1r1: SELECT value FROM recno_rc_test WHERE id = 1;
value
-----
(0 rows)

step s2c: COMMIT;
step s1r2: SELECT value FROM recno_rc_test WHERE id = 1;
value
-----
   20
(1 row)

step s1c: COMMIT;

starting permutation: s1i s2ra s1c s2ra s2c
s3: WARNING:  there is already a transaction in progress
step s1i: INSERT INTO recno_rc_test VALUES (4, 40);
step s2ra: SELECT * FROM recno_rc_test ORDER BY id;
id|value
--+-----
 1|   10
 2|   20
 3|   30
(3 rows)

step s1c: COMMIT;
step s2ra: SELECT * FROM recno_rc_test ORDER BY id;
id|value
--+-----
 1|   10
 2|   20
 3|   30
 4|   40
(4 rows)

step s2c: COMMIT;

starting permutation: s1d s2ra s1c s2ra s2c
s3: WARNING:  there is already a transaction in progress
step s1d: DELETE FROM recno_rc_test WHERE id = 3;
step s2ra: SELECT * FROM recno_rc_test ORDER BY id;
id|value
--+-----
 1|   10
 2|   20
(2 rows)

step s1c: COMMIT;
step s2ra: SELECT * FROM recno_rc_test ORDER BY id;
id|value
--+-----
 1|   10
 2|   20
(2 rows)

step s2c: COMMIT;

starting permutation: s1u s2u_cond s1c s2c s3ra s3c
s3: WARNING:  there is already a transaction in progress
step s1u: UPDATE recno_rc_test SET value = value + 1 WHERE id = 1;
step s2u_cond: UPDATE recno_rc_test SET value = value + 10 WHERE id = 1 AND value < 15;
step s1c: COMMIT;
step s2c: COMMIT;
step s3ra: SELECT * FROM recno_rc_test ORDER BY id;
id|value
--+-----
 1|   11
 2|   20
 3|   30
(3 rows)

step s3c: COMMIT;

starting permutation: s2u s2u_cond s2c s1r1 s1c
step s2u: UPDATE recno_rc_test SET value = value + 10 WHERE id = 1;
step s2u_cond: UPDATE recno_rc_test SET value = value + 10 WHERE id = 1 AND value < 15;
step s2c: COMMIT;
step s1r1: SELECT value FROM recno_rc_test WHERE id = 1;
value
-----
   20
(1 row)

step s1c: COMMIT;

starting permutation: s1u s2r s1c s2r s2c
s3: WARNING:  there is already a transaction in progress
step s1u: UPDATE recno_rc_test SET value = value + 1 WHERE id = 1;
step s2r: SELECT value FROM recno_rc_test WHERE id = 1;
value
-----
(0 rows)

step s1c: COMMIT;
step s2r: SELECT value FROM recno_rc_test WHERE id = 1;
value
-----
   11
(1 row)

step s2c: COMMIT;

starting permutation: s1u s1i s2ra s1rb s2ra s2c
s3: WARNING:  there is already a transaction in progress
step s1u: UPDATE recno_rc_test SET value = value + 1 WHERE id = 1;
step s1i: INSERT INTO recno_rc_test VALUES (4, 40);
step s2ra: SELECT * FROM recno_rc_test ORDER BY id;
id|value
--+-----
 2|   20
 3|   30
(2 rows)

step s1rb: ROLLBACK;
step s2ra: SELECT * FROM recno_rc_test ORDER BY id;
id|value
--+-----
 2|   20
 3|   30
(2 rows)

step s2c: COMMIT;

starting permutation: s1d s2d s1c s2c s3ra s3c
s3: WARNING:  there is already a transaction in progress
step s1d: DELETE FROM recno_rc_test WHERE id = 3;
step s2d: DELETE FROM recno_rc_test WHERE id = 3;
step s1c: COMMIT;
step s2c: COMMIT;
step s3ra: SELECT * FROM recno_rc_test ORDER BY id;
id|value
--+-----
 1|   10
 2|   20
(2 rows)

step s3c: COMMIT;

starting permutation: s1u s1i s2u s1c s2c s3ra s3c
step s1u: UPDATE recno_rc_test SET value = value + 1 WHERE id = 1;
step s1i: INSERT INTO recno_rc_test VALUES (4, 40);
step s2u: UPDATE recno_rc_test SET value = value + 10 WHERE id = 1;
step s1c: COMMIT;
step s2c: COMMIT;
step s3ra: SELECT * FROM recno_rc_test ORDER BY id;
id|value
--+-----
 1|   11
 2|   20
 3|   30
 4|   40
(4 rows)

step s3c: COMMIT;
