Parsed test spec with 3 sessions

starting permutation: s1_read s2_update_one s2_commit s1_read s1_commit
step s1_read: SELECT id, val, num FROM recno_bi ORDER BY id;
id|val  |num
--+-----+---
 1|alpha|100
 2|beta |200
 3|gamma|300
(3 rows)

step s2_update_one: UPDATE recno_bi SET val = 'ALPHA', num = 101 WHERE id = 1;
step s2_commit: COMMIT;
step s1_read: SELECT id, val, num FROM recno_bi ORDER BY id;
id|val  |num
--+-----+---
 1|alpha|100
 2|beta |200
 3|gamma|300
(3 rows)

step s1_commit: COMMIT;

starting permutation: s1_read s2_update_one s2_update_two s2_commit s1_read s1_commit
step s1_read: SELECT id, val, num FROM recno_bi ORDER BY id;
id|val  |num
--+-----+---
 1|alpha|100
 2|beta |200
 3|gamma|300
(3 rows)

step s2_update_one: UPDATE recno_bi SET val = 'ALPHA', num = 101 WHERE id = 1;
step s2_update_two: UPDATE recno_bi SET val = 'BETA', num = 202 WHERE id = 2;
step s2_commit: COMMIT;
step s1_read: SELECT id, val, num FROM recno_bi ORDER BY id;
id|val  |num
--+-----+---
 1|alpha|100
 2|beta |200
 3|gamma|300
(3 rows)

step s1_commit: COMMIT;

starting permutation: s1_read s2_update_one s2_commit s3_begin_rr s3_read s1_read s3_commit s1_commit
step s1_read: SELECT id, val, num FROM recno_bi ORDER BY id;
id|val  |num
--+-----+---
 1|alpha|100
 2|beta |200
 3|gamma|300
(3 rows)

step s2_update_one: UPDATE recno_bi SET val = 'ALPHA', num = 101 WHERE id = 1;
step s2_commit: COMMIT;
step s3_begin_rr: BEGIN ISOLATION LEVEL REPEATABLE READ;
step s3_read: SELECT id, val, num FROM recno_bi ORDER BY id;
id|val  |num
--+-----+---
 1|ALPHA|101
 2|beta |200
 3|gamma|300
(3 rows)

step s1_read: SELECT id, val, num FROM recno_bi ORDER BY id;
id|val  |num
--+-----+---
 1|alpha|100
 2|beta |200
 3|gamma|300
(3 rows)

step s3_commit: COMMIT;
step s1_commit: COMMIT;

starting permutation: s1_read s2_update_one s2_commit s3_begin_rc s3_read s1_read s3_commit s1_commit
step s1_read: SELECT id, val, num FROM recno_bi ORDER BY id;
id|val  |num
--+-----+---
 1|alpha|100
 2|beta |200
 3|gamma|300
(3 rows)

step s2_update_one: UPDATE recno_bi SET val = 'ALPHA', num = 101 WHERE id = 1;
step s2_commit: COMMIT;
step s3_begin_rc: BEGIN ISOLATION LEVEL READ COMMITTED;
step s3_read: SELECT id, val, num FROM recno_bi ORDER BY id;
id|val  |num
--+-----+---
 1|ALPHA|101
 2|beta |200
 3|gamma|300
(3 rows)

step s1_read: SELECT id, val, num FROM recno_bi ORDER BY id;
id|val  |num
--+-----+---
 1|alpha|100
 2|beta |200
 3|gamma|300
(3 rows)

step s3_commit: COMMIT;
step s1_commit: COMMIT;

starting permutation: s1_read s2_update_one s2_update_chain s2_commit s1_read s1_commit
step s1_read: SELECT id, val, num FROM recno_bi ORDER BY id;
id|val  |num
--+-----+---
 1|alpha|100
 2|beta |200
 3|gamma|300
(3 rows)

step s2_update_one: UPDATE recno_bi SET val = 'ALPHA', num = 101 WHERE id = 1;
step s2_update_chain: UPDATE recno_bi SET val = 'ALPHA_V2', num = 111 WHERE id = 1;
step s2_commit: COMMIT;
step s1_read: SELECT id, val, num FROM recno_bi ORDER BY id;
id|val  |num
--+-----+---
 1|alpha|100
 2|beta |200
 3|gamma|300
(3 rows)

step s1_commit: COMMIT;
