create extension pg_surgery;
-- create a normal heap table and insert some rows.
-- use a temp table so that vacuum behavior doesn't depend on global xmin
create temp table htab (a int);
insert into htab values (100), (200), (300), (400), (500);
-- test empty TID array
select heap_force_freeze('htab'::regclass, ARRAY[]::tid[]);
 heap_force_freeze 
-------------------
 
(1 row)

-- nothing should be frozen yet
select * from htab where xmin = 2;
 a 
---
(0 rows)

-- freeze forcibly
select heap_force_freeze('htab'::regclass, ARRAY['(0, 4)']::tid[]);
 heap_force_freeze 
-------------------
 
(1 row)

-- now we should have one frozen tuple
select ctid, xmax from htab where xmin = 2;
 ctid  | xmax 
-------+------
 (0,4) |    0
(1 row)

-- kill forcibly
select heap_force_kill('htab'::regclass, ARRAY['(0, 4)']::tid[]);
 heap_force_kill 
-----------------
 
(1 row)

-- should be gone now
select * from htab where ctid = '(0, 4)';
 a 
---
(0 rows)

-- should now be skipped because it's already dead
select heap_force_kill('htab'::regclass, ARRAY['(0, 4)']::tid[]);
NOTICE:  skipping tid (0, 4) for relation "htab" because it is marked dead
 heap_force_kill 
-----------------
 
(1 row)

select heap_force_freeze('htab'::regclass, ARRAY['(0, 4)']::tid[]);
NOTICE:  skipping tid (0, 4) for relation "htab" because it is marked dead
 heap_force_freeze 
-------------------
 
(1 row)

-- freeze two TIDs at once while skipping an out-of-range block number
select heap_force_freeze('htab'::regclass,
						 ARRAY['(0, 1)', '(0, 3)', '(1, 1)']::tid[]);
NOTICE:  skipping block 1 for relation "htab" because the block number is out of range
 heap_force_freeze 
-------------------
 
(1 row)

-- we should now have two frozen tuples
select ctid, xmax from htab where xmin = 2;
 ctid  | xmax 
-------+------
 (0,1) |    0
 (0,3) |    0
(2 rows)

-- out-of-range TIDs should be skipped
select heap_force_freeze('htab'::regclass, ARRAY['(0, 0)', '(0, 6)']::tid[]);
NOTICE:  skipping tid (0, 0) for relation "htab" because the item number is out of range
NOTICE:  skipping tid (0, 6) for relation "htab" because the item number is out of range
 heap_force_freeze 
-------------------
 
(1 row)

-- set up a new table with a redirected line pointer
-- use a temp table so that vacuum behavior doesn't depend on global xmin
create temp table htab2(a int);
insert into htab2 values (100);
update htab2 set a = 200;
vacuum htab2;
-- redirected TIDs should be skipped
select heap_force_kill('htab2'::regclass, ARRAY['(0, 1)']::tid[]);
NOTICE:  skipping tid (0, 1) for relation "htab2" because it redirects to item 2
 heap_force_kill 
-----------------
 
(1 row)

-- now create an unused line pointer
select ctid from htab2;
 ctid  
-------
 (0,2)
(1 row)

update htab2 set a = 300;
select ctid from htab2;
 ctid  
-------
 (0,3)
(1 row)

vacuum freeze htab2;
-- unused TIDs should be skipped
select heap_force_kill('htab2'::regclass, ARRAY['(0, 2)']::tid[]);
NOTICE:  skipping tid (0, 2) for relation "htab2" because it is marked unused
 heap_force_kill 
-----------------
 
(1 row)

-- multidimensional TID array should be rejected
select heap_force_kill('htab2'::regclass, ARRAY[['(0, 2)']]::tid[]);
ERROR:  argument must be empty or one-dimensional array
-- TID array with nulls should be rejected
select heap_force_kill('htab2'::regclass, ARRAY[NULL]::tid[]);
ERROR:  array must not contain nulls
-- but we should be able to kill the one tuple we have
select heap_force_kill('htab2'::regclass, ARRAY['(0, 3)']::tid[]);
 heap_force_kill 
-----------------
 
(1 row)

-- materialized view.
-- note that we don't commit the transaction, so autovacuum can't interfere.
begin;
create materialized view mvw as select a from generate_series(1, 3) a;
select * from mvw where xmin = 2;
 a 
---
(0 rows)

select heap_force_freeze('mvw'::regclass, ARRAY['(0, 3)']::tid[]);
 heap_force_freeze 
-------------------
 
(1 row)

select * from mvw where xmin = 2;
 a 
---
 3
(1 row)

select heap_force_kill('mvw'::regclass, ARRAY['(0, 3)']::tid[]);
 heap_force_kill 
-----------------
 
(1 row)

select * from mvw where ctid = '(0, 3)';
 a 
---
(0 rows)

rollback;
-- check that it fails on an unsupported relkind
create view vw as select 1;
select heap_force_kill('vw'::regclass, ARRAY['(0, 1)']::tid[]);
ERROR:  cannot operate on relation "vw"
DETAIL:  This operation is not supported for views.
select heap_force_freeze('vw'::regclass, ARRAY['(0, 1)']::tid[]);
ERROR:  cannot operate on relation "vw"
DETAIL:  This operation is not supported for views.
-- HOT-indexed bridge meta-items are LP_NORMAL items that are not real tuples;
-- forcing them would corrupt the heap (freeze would surface a phantom
-- natts==0 row, kill would drop a chain hop), so both functions must skip them.
create extension pageinspect;
create table htomb (id int primary key, a int, b int) with (fillfactor = 50);
create index htomb_a on htomb(a);
insert into htomb values (1, 10, 20);
-- Two HOT-indexed updates on an indexed attr, then prune: the dead mid-chain
-- version is rewritten as a bridge meta-item (LP_NORMAL, HEAP_INDEXED_UPDATED,
-- natts=0).  INDEX_CLEANUP off keeps the bridge in place.
update htomb set a = 11 where id = 1;
update htomb set a = 12 where id = 1;
vacuum (index_cleanup off) htomb;
select n_hot_indexed > 0 as made_hot_indexed
  from pg_relation_hot_indexed_stats('htomb');
 made_hot_indexed 
------------------
 t
(1 row)

-- locate the bridge on block 0: LP_NORMAL item with HEAP_INDEXED_UPDATED
-- (infomask2 & 0x0800) set and natts (infomask2 & 0x07FF) zero.
select lp as tomb_off
  from heap_page_items(get_raw_page('htomb', 0))
 where lp_flags = 1 and (t_infomask2 & 2048) <> 0 and (t_infomask2 & 2047) = 0 \gset
-- both surgery ops must skip it (NOTICE), leaving the heap unchanged
select heap_force_freeze('htomb'::regclass, ARRAY[('(0,' || :tomb_off || ')')::tid]);
NOTICE:  skipping tid (0, 2) for relation "htomb" because it is a HOT-indexed tombstone
 heap_force_freeze 
-------------------
 
(1 row)

select heap_force_kill('htomb'::regclass, ARRAY[('(0,' || :tomb_off || ')')::tid]);
NOTICE:  skipping tid (0, 2) for relation "htomb" because it is a HOT-indexed tombstone
 heap_force_kill 
-----------------
 
(1 row)

-- live row intact, no phantom
select id, a, b from htomb;
 id | a  | b  
----+----+----
  1 | 12 | 20
(1 row)

drop table htomb;
drop extension pageinspect;
-- cleanup.
drop view vw;
drop extension pg_surgery;
