--
-- BUFFERPOOL
-- Tests for dynamic buffer pool infrastructure: CREATE, ALTER, DROP
-- BUFFER POOL, pg_bufferpool catalog, and pg_stat_bufferpool view.
--
-- View the default pool in the stats view
SELECT name FROM pg_stat_bufferpool;
  name   
---------
 default
(1 row)

-- Verify the default pool exists in the catalog
SELECT bpname, bpsize FROM pg_bufferpool WHERE bpname = 'default';
 bpname  | bpsize 
---------+--------
 default |      0
(1 row)

-- Create a clock-sweep buffer pool (256KB = 32 pages)
CREATE BUFFER POOL test_pool HANDLER clock_pool_handler SIZE '262144';
-- Verify catalog entry
SELECT bpname, bpsize FROM pg_bufferpool WHERE bpname = 'test_pool';
  bpname   | bpsize 
-----------+--------
 test_pool | 262144
(1 row)

-- Verify it shows up in the stats view
SELECT name, nbuffers FROM pg_stat_bufferpool WHERE name = 'test_pool';
   name    | nbuffers 
-----------+----------
 test_pool |       32
(1 row)

-- Rename the pool
ALTER BUFFER POOL test_pool RENAME TO test_pool_renamed;
-- Verify the rename in the catalog
SELECT bpname FROM pg_bufferpool WHERE bpname = 'test_pool_renamed';
      bpname       
-------------------
 test_pool_renamed
(1 row)

-- Old name should be gone
SELECT count(*) FROM pg_bufferpool WHERE bpname = 'test_pool';
 count 
-------
     0
(1 row)

-- Verify the renamed pool is in the stats view
SELECT name FROM pg_stat_bufferpool WHERE name = 'test_pool_renamed';
       name        
-------------------
 test_pool_renamed
(1 row)

-- Create a second pool to verify multiple pools work
CREATE BUFFER POOL test_pool2 HANDLER clock_pool_handler SIZE '262144';
-- Should have the default plus two custom pools
SELECT count(*) FROM pg_stat_bufferpool;
 count 
-------
     3
(1 row)

-- ===================================================
-- Data flow: actual reads/writes through dynamic pool
-- ===================================================
-- Create a data pool (1MB = 128 pages) with clock-sweep
CREATE BUFFER POOL data_pool HANDLER clock_pool_handler SIZE '1048576';
-- Create a table assigned to the pool
CREATE TABLE bp_data (id int, val text) WITH (buffer_pool = 'data_pool');
-- Insert 1000 rows
INSERT INTO bp_data SELECT g, 'row-' || g FROM generate_series(1, 1000) g;
-- Verify data reads back correctly
SELECT count(*) FROM bp_data;
 count 
-------
  1000
(1 row)

SELECT min(id), max(id) FROM bp_data;
 min | max  
-----+------
   1 | 1000
(1 row)

SELECT val FROM bp_data WHERE id = 500;
   val   
---------
 row-500
(1 row)

-- Update some rows
UPDATE bp_data SET val = 'updated-' || id WHERE id <= 10;
SELECT val FROM bp_data WHERE id = 5;
    val    
-----------
 updated-5
(1 row)

-- Delete some rows
DELETE FROM bp_data WHERE id > 990;
SELECT count(*) FROM bp_data;
 count 
-------
   990
(1 row)

-- Create an index on the pooled table
CREATE INDEX bp_data_idx ON bp_data (id);
-- Use the index
SELECT val FROM bp_data WHERE id = 42;
  val   
--------
 row-42
(1 row)

-- VACUUM the pooled table
VACUUM bp_data;
-- Check pool stats (hits expected from repeated access; reads may be zero
-- if I/O was served entirely from OS page cache)
SELECT reads > 0 AS has_reads, hits > 0 AS has_hits
FROM pg_stat_bufferpool WHERE name = 'data_pool';
 has_reads | has_hits 
-----------+----------
 f         | t
(1 row)

-- Clean up
DROP TABLE bp_data;
DROP BUFFER POOL data_pool;
-- ===================================================
-- Multi-pool: two pools with tables, cross-pool JOIN
-- ===================================================
CREATE BUFFER POOL pool_a HANDLER clock_pool_handler SIZE '524288';
CREATE BUFFER POOL pool_b HANDLER clock_pool_handler SIZE '524288';
CREATE TABLE bp_tbl_a (id int, label text) WITH (buffer_pool = 'pool_a');
CREATE TABLE bp_tbl_b (id int, score int) WITH (buffer_pool = 'pool_b');
INSERT INTO bp_tbl_a SELECT g, 'item-' || g FROM generate_series(1, 100) g;
INSERT INTO bp_tbl_b SELECT g, g * 10 FROM generate_series(1, 100) g;
-- Cross-pool join
SELECT a.label, b.score FROM bp_tbl_a a JOIN bp_tbl_b b ON a.id = b.id
WHERE a.id = 50;
  label  | score 
---------+-------
 item-50 |   500
(1 row)

-- Both pools should be visible in stats
SELECT name, reads > 0 AS has_reads FROM pg_stat_bufferpool
WHERE name IN ('pool_a', 'pool_b') ORDER BY name;
  name  | has_reads 
--------+-----------
 pool_a | f
 pool_b | f
(2 rows)

-- Clean up
DROP TABLE bp_tbl_a;
DROP TABLE bp_tbl_b;
DROP BUFFER POOL pool_a;
DROP BUFFER POOL pool_b;
-- ===================================================
-- Checkpoint persistence through a dynamic pool
-- ===================================================
CREATE BUFFER POOL ckpt_pool HANDLER clock_pool_handler SIZE '524288';
CREATE TABLE bp_ckpt_tbl (id int, data text) WITH (buffer_pool = 'ckpt_pool');
INSERT INTO bp_ckpt_tbl SELECT g, 'persist-' || g FROM generate_series(1, 100) g;
-- Force a checkpoint
CHECKPOINT;
-- Verify data survived the checkpoint
SELECT count(*) FROM bp_ckpt_tbl;
 count 
-------
   100
(1 row)

SELECT data FROM bp_ckpt_tbl WHERE id = 42;
    data    
------------
 persist-42
(1 row)

-- Clean up
DROP TABLE bp_ckpt_tbl;
DROP BUFFER POOL ckpt_pool;
--
-- Error cases
--
-- Cannot create a pool named "default" (already exists)
CREATE BUFFER POOL "default" HANDLER clock_pool_handler SIZE '262144';
ERROR:  buffer pool "default" already exists
-- Duplicate pool name
CREATE BUFFER POOL dup_test HANDLER clock_pool_handler SIZE '262144';
CREATE BUFFER POOL dup_test HANDLER clock_pool_handler SIZE '262144';
ERROR:  buffer pool "dup_test" already exists
-- DROP IF EXISTS on a nonexistent pool should succeed with NOTICE
DROP BUFFER POOL IF EXISTS no_such_pool;
NOTICE:  buffer pool "no_such_pool" does not exist, skipping
-- Creating a table with a nonexistent buffer_pool reloption just stores the string
CREATE TABLE bp_nopool (id int) WITH (buffer_pool = 'nonexistent');
WARNING:  buffer pool "nonexistent" does not exist, using default pool
DROP TABLE bp_nopool;
WARNING:  buffer pool "nonexistent" does not exist, using default pool
-- Cannot drop the default pool
DROP BUFFER POOL "default";
ERROR:  cannot drop buffer pool default because it is required by the database system
-- Cannot drop a pool with dependent relations
CREATE BUFFER POOL dep_test HANDLER clock_pool_handler SIZE '262144';
CREATE TABLE bp_dep_tbl (id int) WITH (buffer_pool = 'dep_test');
DROP BUFFER POOL dep_test;
ERROR:  cannot drop buffer pool "dep_test" because relation "bp_dep_tbl" depends on it
HINT:  Remove the buffer_pool reloption from dependent relations first.
DROP TABLE bp_dep_tbl;
-- Pool with SIZE too small (< 16 * 8192 = 131072)
CREATE BUFFER POOL tiny_pool HANDLER clock_pool_handler SIZE '8192';
ERROR:  buffer pool size must be at least 131072 bytes
-- Invalid handler function name
CREATE BUFFER POOL bad_handler HANDLER nonexistent_handler SIZE '262144';
ERROR:  function nonexistent_handler(internal) does not exist
-- DROP without IF EXISTS on nonexistent pool
DROP BUFFER POOL no_such_pool;
ERROR:  buffer pool "no_such_pool" does not exist
--
-- DROP BUFFER POOL (successful cases)
--
-- Drop the pools created above (also terminates their trickle writers)
DROP BUFFER POOL test_pool_renamed;
DROP BUFFER POOL test_pool2;
DROP BUFFER POOL dup_test;
DROP BUFFER POOL dep_test;
-- Verify they are gone from the catalog
SELECT bpname FROM pg_bufferpool WHERE bpname IN ('test_pool_renamed', 'test_pool2', 'dup_test', 'dep_test');
 bpname 
--------
(0 rows)

-- Only the default pool should remain in the stats view
SELECT count(*) FROM pg_stat_bufferpool;
 count 
-------
     1
(1 row)

