--
-- recno_enable_undo
--
-- Exercise the RECNO UNDO-in-WAL write / sLog / rollback path end-to-end.
-- UNDO is always-on infrastructure; RECNO unconditionally writes UNDO
-- records via am_supports_undo.  This test verifies rollback visibility.
--
-- Create a RECNO table (UNDO always active for RECNO AM)
CREATE TABLE recno_undo_baseline (id int PRIMARY KEY, s text) USING recno;
INSERT INTO recno_undo_baseline VALUES (1,'a'), (2,'b'), (3,'c');
-- Aborted INSERT: row must be invisible after ROLLBACK
BEGIN;
INSERT INTO recno_undo_baseline VALUES (99, 'rollback-insert');
-- visible inside the aborting transaction
SELECT count(*) FROM recno_undo_baseline WHERE id = 99;
 count 
-------
     1
(1 row)

ROLLBACK;
-- invisible after rollback
SELECT count(*) FROM recno_undo_baseline WHERE id = 99;
 count 
-------
     0
(1 row)

SELECT * FROM recno_undo_baseline WHERE id = 99;
 id | s 
----+---
(0 rows)

-- Aborted UPDATE: readers must not see the aborted value
BEGIN;
UPDATE recno_undo_baseline SET s = 'rollback-update' WHERE id = 1;
SELECT s FROM recno_undo_baseline WHERE id = 1;   -- own view inside txn
        s        
-----------------
 rollback-update
(1 row)

ROLLBACK;
SELECT count(*) FILTER (WHERE s = 'rollback-update') AS aborted_visible FROM recno_undo_baseline;
 aborted_visible 
-----------------
               0
(1 row)

-- Aborted DELETE: readers must not see the tuple as deleted
BEGIN;
DELETE FROM recno_undo_baseline WHERE id = 2;
ROLLBACK;
SELECT count(*) FILTER (WHERE id = 2) AS committed_delete_visible FROM recno_undo_baseline;
 committed_delete_visible 
--------------------------
                        0
(1 row)

-- Savepoint rollback: only the rolled-back subtransaction's writes disappear
BEGIN;
INSERT INTO recno_undo_baseline VALUES (100, 'outer');
SAVEPOINT s1;
INSERT INTO recno_undo_baseline VALUES (101, 'inner-rolled');
UPDATE recno_undo_baseline SET s = 'inner-updated' WHERE id = 3;
ROLLBACK TO SAVEPOINT s1;
-- After ROLLBACK TO, id=100 persists; id=101 and the UPDATE on id=3 may
-- still be physically present (sLog-driven invisibility handles them).
SELECT id FROM recno_undo_baseline
  WHERE s NOT IN ('inner-rolled', 'inner-updated') ORDER BY id;
 id  
-----
 100
(1 row)

COMMIT;
SELECT id FROM recno_undo_baseline ORDER BY id;
 id  
-----
   3
 100
 101
(3 rows)

-- RECNO always writes UNDO records; no GUC check needed.
CREATE TABLE recno_undo_on (id int, s text) USING recno;
INSERT INTO recno_undo_on VALUES (1,'a'),(2,'b');
DROP TABLE recno_undo_on;
DROP TABLE recno_undo_baseline;
--
-- recno feature-flag opt-out: with -Drecno=disabled the RECNO AM must not
-- exist at all.  When built with recno enabled (the default), recno must
-- be present in pg_am and every recno_* GUC must be registered.
--
-- RECNO is registered
SELECT amname, amtype FROM pg_am WHERE amname = 'recno';
 amname | amtype 
--------+--------
 recno  | t
(1 row)

-- All recno_* GUCs are registered with their declared groups
SELECT name, category
  FROM pg_settings
  WHERE name LIKE 'recno\_%' ESCAPE '\'
  ORDER BY name;
            name             |                    category                     
-----------------------------+-------------------------------------------------
 recno_compression_algorithm | Resource Usage / Memory
 recno_compression_level     | Resource Usage / Memory
 recno_enable_compression    | Resource Usage / Memory
 recno_max_clock_offset_ms   | Client Connection Defaults / Statement Behavior
 recno_node_id               | Replication / Sending Servers
 recno_uncertainty_wait      | Replication / Standby Servers
 recno_use_hlc               | Client Connection Defaults / Statement Behavior
(7 rows)

