--
-- recno_compression_full.sql
--
-- Comprehensive validation of RECNO compression system integration.
--
-- Tests:
--   1. Compression wired into RecnoFormTuple / RecnoFormTupleWithOverflow
--   2. Decompression wired into RecnoDeformTuple / RecnoTupleToSlot
--   3. GUC checks (recno_enable_compression, recno_compression_algorithm, etc.)
--   4. Highly compressible data (repetitive text, all-same bytes)
--   5. Incompressible data (random bytes via md5)
--   6. LZ4 and ZSTD algorithm paths
--   7. Delta compression for numeric types
--   8. Dictionary compression for text types
--   9. Compression disabled: data round-trips unchanged
--  10. Mixed NULL / non-NULL compressed columns
--  11. Compression across UPDATE (in-place and cross-page)
--  12. Compression with VACUUM (dead-tuple reclaim + re-insert)
--  13. Compression with index scans (decompression on retrieval)
--  14. Edge cases: empty, below-threshold, at-threshold sizes
--
-- =============================================
-- 0. Verify GUCs exist
-- =============================================
SHOW recno_enable_compression;
 recno_enable_compression 
--------------------------
 on
(1 row)

SHOW recno_compression_level;
 recno_compression_level 
-------------------------
 3
(1 row)

SHOW recno_compression_algorithm;
 recno_compression_algorithm 
-----------------------------
 auto
(1 row)

-- =============================================
-- 1. Round-trip: highly compressible text data
-- =============================================
SET recno_enable_compression = on;
CREATE TABLE recno_cfull_rep_text (
    id serial PRIMARY KEY,
    data text
) USING recno;
-- 50 repetitions of a 58-char string = 2900 chars per row, highly compressible
INSERT INTO recno_cfull_rep_text (data)
SELECT repeat('This is a highly repetitive string for compression testing. ', 50)
FROM generate_series(1, 200);
-- Verify row count and data integrity
SELECT COUNT(*) AS row_count FROM recno_cfull_rep_text;
 row_count 
-----------
       200
(1 row)

SELECT length(data) AS expected_2900 FROM recno_cfull_rep_text LIMIT 1;
 expected_2900 
---------------
          3000
(1 row)

-- Every row must decompress to the identical string
SELECT COUNT(*) AS mismatches
FROM recno_cfull_rep_text
WHERE data <> repeat('This is a highly repetitive string for compression testing. ', 50);
 mismatches 
------------
          0
(1 row)

SELECT pg_size_pretty(pg_relation_size('recno_cfull_rep_text')) AS compressed_table_size;
 compressed_table_size 
-----------------------
 40 kB
(1 row)

DROP TABLE recno_cfull_rep_text;
-- =============================================
-- 2. Round-trip: incompressible data (random hex)
-- =============================================
SET recno_enable_compression = on;
CREATE TABLE recno_cfull_rand (
    id serial PRIMARY KEY,
    data text
) USING recno;
-- md5 output is 32 hex chars; concat 100 of them = 3200 random chars
INSERT INTO recno_cfull_rand (data)
SELECT string_agg(md5(random()::text || i::text), '')
FROM generate_series(1, 100) i, generate_series(1, 50) j
GROUP BY j;
SELECT COUNT(*) AS row_count FROM recno_cfull_rand;
 row_count 
-----------
        50
(1 row)

-- Verify lengths are consistent (3200 per row)
SELECT COUNT(*) AS bad_lengths
FROM recno_cfull_rand
WHERE length(data) <> 3200;
 bad_lengths 
-------------
           0
(1 row)

DROP TABLE recno_cfull_rand;
-- =============================================
-- 3. Compression disabled: exact round-trip
-- =============================================
SET recno_enable_compression = off;
CREATE TABLE recno_cfull_nocomp (
    id serial PRIMARY KEY,
    data text,
    num_val integer,
    bin_val bytea
) USING recno;
INSERT INTO recno_cfull_nocomp (data, num_val, bin_val)
SELECT
    repeat('uncompressed text data ', 60),
    i,
    decode(repeat('FF', 100), 'hex')
FROM generate_series(1, 100) i;
SELECT COUNT(*) AS row_count FROM recno_cfull_nocomp;
 row_count 
-----------
       100
(1 row)

-- Data integrity
SELECT COUNT(*) AS text_mismatches
FROM recno_cfull_nocomp
WHERE data <> repeat('uncompressed text data ', 60);
 text_mismatches 
-----------------
               0
(1 row)

SELECT COUNT(*) AS num_mismatches
FROM recno_cfull_nocomp
WHERE num_val <> id;
 num_mismatches 
----------------
              0
(1 row)

SELECT COUNT(*) AS bin_mismatches
FROM recno_cfull_nocomp
WHERE bin_val <> decode(repeat('FF', 100), 'hex');
 bin_mismatches 
----------------
              0
(1 row)

SELECT pg_size_pretty(pg_relation_size('recno_cfull_nocomp')) AS uncompressed_size;
 uncompressed_size 
-------------------
 200 kB
(1 row)

DROP TABLE recno_cfull_nocomp;
RESET recno_enable_compression;
-- =============================================
-- 4. Compressed vs uncompressed size comparison
-- =============================================
SET recno_enable_compression = on;
CREATE TABLE recno_cfull_comp_on (
    id serial PRIMARY KEY,
    data text
) USING recno;
INSERT INTO recno_cfull_comp_on (data)
SELECT repeat('AAAA compressible payload BBBB ', 80)
FROM generate_series(1, 1000);
SET recno_enable_compression = off;
CREATE TABLE recno_cfull_comp_off (
    id serial PRIMARY KEY,
    data text
) USING recno;
INSERT INTO recno_cfull_comp_off (data)
SELECT repeat('AAAA compressible payload BBBB ', 80)
FROM generate_series(1, 1000);
-- Both must have identical data
SELECT
    (SELECT COUNT(*) FROM recno_cfull_comp_on) AS on_count,
    (SELECT COUNT(*) FROM recno_cfull_comp_off) AS off_count;
 on_count | off_count 
----------+-----------
     1000 |      1000
(1 row)

SELECT
    (SELECT SUM(length(data)) FROM recno_cfull_comp_on) =
    (SELECT SUM(length(data)) FROM recno_cfull_comp_off) AS data_lengths_match;
 data_lengths_match 
--------------------
 t
(1 row)

-- Size comparison: compressed should be smaller (or equal for stub impls).
-- Emit only the relationship; raw byte counts drift with page packing and
-- carry no signal beyond the comparison itself.
SELECT
    pg_relation_size('recno_cfull_comp_on') <= pg_relation_size('recno_cfull_comp_off') AS comp_not_larger;
 comp_not_larger 
-----------------
 t
(1 row)

DROP TABLE recno_cfull_comp_on;
DROP TABLE recno_cfull_comp_off;
RESET recno_enable_compression;
-- =============================================
-- 5. Multiple data types with compression
-- =============================================
SET recno_enable_compression = on;
CREATE TABLE recno_cfull_types (
    id serial PRIMARY KEY,
    seq_int integer,
    small_range integer,
    rep_text text,
    rand_text text,
    rep_bytea bytea,
    rand_bytea bytea,
    amount numeric(12,2),
    big_int bigint
) USING recno;
INSERT INTO recno_cfull_types (
    seq_int, small_range,
    rep_text, rand_text,
    rep_bytea, rand_bytea,
    amount, big_int
)
SELECT
    i,
    i % 10,
    repeat('abc', 100),
    md5(i::text),
    decode(repeat('DEADBEEF', 25), 'hex'),
    decode(md5(i::text), 'hex'),
    (i * 1.23)::numeric(12,2),
    i::bigint * 1000000
FROM generate_series(1, 500) i;
-- Verify all types round-trip
SELECT COUNT(*) AS row_count FROM recno_cfull_types;
 row_count 
-----------
       500
(1 row)

SELECT
    MIN(seq_int) AS min_seq, MAX(seq_int) AS max_seq,
    COUNT(DISTINCT small_range) AS distinct_small,
    AVG(amount)::numeric(12,2) AS avg_amount,
    MIN(big_int) AS min_big, MAX(big_int) AS max_big
FROM recno_cfull_types;
 min_seq | max_seq | distinct_small | avg_amount | min_big |  max_big  
---------+---------+----------------+------------+---------+-----------
       1 |     500 |             10 |     308.12 | 1000000 | 500000000
(1 row)

-- Spot-check specific row
SELECT
    seq_int, small_range,
    length(rep_text) AS rep_len,
    length(rand_text) AS rand_len,
    rep_text = repeat('abc', 100) AS rep_ok,
    rand_text = md5('1') AS rand_ok,
    rep_bytea = decode(repeat('DEADBEEF', 25), 'hex') AS bytea_ok,
    rand_bytea = decode(md5('1'), 'hex') AS rand_bytea_ok,
    amount, big_int
FROM recno_cfull_types WHERE id = 1;
 seq_int | small_range | rep_len | rand_len | rep_ok | rand_ok | bytea_ok | rand_bytea_ok | amount | big_int 
---------+-------------+---------+----------+--------+---------+----------+---------------+--------+---------
       1 |           1 |     300 |       32 | t      | t       | t        | t             |   1.23 | 1000000
(1 row)

DROP TABLE recno_cfull_types;
-- =============================================
-- 6. LZ4 algorithm path
-- =============================================
SET recno_enable_compression = on;
SET recno_compression_algorithm = 'lz4';
CREATE TABLE recno_cfull_lz4 (
    id serial PRIMARY KEY,
    data text
) USING recno;
INSERT INTO recno_cfull_lz4 (data)
SELECT repeat('LZ4 compression test payload with repetitive content. ', 80)
FROM generate_series(1, 200);
SELECT COUNT(*) AS row_count FROM recno_cfull_lz4;
 row_count 
-----------
       200
(1 row)

-- Verify decompression correctness
SELECT COUNT(*) AS mismatches
FROM recno_cfull_lz4
WHERE data <> repeat('LZ4 compression test payload with repetitive content. ', 80);
 mismatches 
------------
          0
(1 row)

SELECT pg_size_pretty(pg_relation_size('recno_cfull_lz4')) AS lz4_size;
 lz4_size 
----------
 40 kB
(1 row)

DROP TABLE recno_cfull_lz4;
RESET recno_compression_algorithm;
-- =============================================
-- 7. ZSTD algorithm path
-- =============================================
SET recno_enable_compression = on;
SET recno_compression_algorithm = 'zstd';
CREATE TABLE recno_cfull_zstd (
    id serial PRIMARY KEY,
    data text
) USING recno;
INSERT INTO recno_cfull_zstd (data)
SELECT repeat('ZSTD compression test payload with repetitive content. ', 80)
FROM generate_series(1, 200);
SELECT COUNT(*) AS row_count FROM recno_cfull_zstd;
 row_count 
-----------
       200
(1 row)

-- Verify decompression correctness
SELECT COUNT(*) AS mismatches
FROM recno_cfull_zstd
WHERE data <> repeat('ZSTD compression test payload with repetitive content. ', 80);
 mismatches 
------------
          0
(1 row)

SELECT pg_size_pretty(pg_relation_size('recno_cfull_zstd')) AS zstd_size;
 zstd_size 
-----------
 40 kB
(1 row)

DROP TABLE recno_cfull_zstd;
RESET recno_compression_algorithm;
-- =============================================
-- 8. Compression with varying compression levels
-- =============================================
SET recno_enable_compression = on;
-- Low compression level
SET recno_compression_level = 1;
CREATE TABLE recno_cfull_level1 (
    id serial PRIMARY KEY,
    data text
) USING recno;
INSERT INTO recno_cfull_level1 (data)
SELECT repeat('level test ', 200) FROM generate_series(1, 100);
SELECT pg_relation_size('recno_cfull_level1') AS level1_bytes;
 level1_bytes 
--------------
        16384
(1 row)

DROP TABLE recno_cfull_level1;
-- High compression level
SET recno_compression_level = 9;
CREATE TABLE recno_cfull_level9 (
    id serial PRIMARY KEY,
    data text
) USING recno;
INSERT INTO recno_cfull_level9 (data)
SELECT repeat('level test ', 200) FROM generate_series(1, 100);
SELECT pg_relation_size('recno_cfull_level9') AS level9_bytes;
 level9_bytes 
--------------
        16384
(1 row)

-- Verify data at high level
SELECT COUNT(*) AS mismatches
FROM recno_cfull_level9
WHERE data <> repeat('level test ', 200);
 mismatches 
------------
          0
(1 row)

DROP TABLE recno_cfull_level9;
RESET recno_compression_level;
-- =============================================
-- 9. NULL handling with compression
-- =============================================
SET recno_enable_compression = on;
CREATE TABLE recno_cfull_nulls (
    id serial PRIMARY KEY,
    col1 text,
    col2 text,
    col3 integer
) USING recno;
INSERT INTO recno_cfull_nulls (col1, col2, col3)
SELECT
    CASE WHEN i % 2 = 0 THEN repeat('nullable_' || i::text, 50) ELSE NULL END,
    CASE WHEN i % 3 = 0 THEN repeat('col2_' || i::text, 50) ELSE NULL END,
    CASE WHEN i % 5 = 0 THEN i ELSE NULL END
FROM generate_series(1, 300) i;
SELECT
    COUNT(*) AS total,
    COUNT(col1) AS non_null_col1,
    COUNT(col2) AS non_null_col2,
    COUNT(col3) AS non_null_col3
FROM recno_cfull_nulls;
 total | non_null_col1 | non_null_col2 | non_null_col3 
-------+---------------+---------------+---------------
   300 |           150 |           100 |            60
(1 row)

-- Verify specific NULL pattern
SELECT id, col1 IS NULL AS c1_null, col2 IS NULL AS c2_null, col3 IS NULL AS c3_null
FROM recno_cfull_nulls WHERE id <= 10 ORDER BY id;
 id | c1_null | c2_null | c3_null 
----+---------+---------+---------
  1 | t       | t       | t
  2 | f       | t       | t
  3 | t       | f       | t
  4 | f       | t       | t
  5 | t       | t       | f
  6 | f       | f       | t
  7 | t       | t       | t
  8 | f       | t       | t
  9 | t       | f       | t
 10 | f       | t       | f
(10 rows)

-- Verify non-NULL data is correct
SELECT COUNT(*) AS col1_bad
FROM recno_cfull_nulls
WHERE col1 IS NOT NULL AND col1 <> repeat('nullable_' || id::text, 50);
 col1_bad 
----------
        0
(1 row)

DROP TABLE recno_cfull_nulls;
-- =============================================
-- 10. Compression with UPDATE operations
-- =============================================
SET recno_enable_compression = on;
CREATE TABLE recno_cfull_upd (
    id serial PRIMARY KEY,
    data text,
    counter integer DEFAULT 0
) USING recno;
INSERT INTO recno_cfull_upd (data)
SELECT repeat('original data for update test ', 50)
FROM generate_series(1, 200);
-- Update to shorter data (in-place likely)
UPDATE recno_cfull_upd SET data = 'short' WHERE id <= 50;
-- Update to much longer data (cross-page possible)
UPDATE recno_cfull_upd SET data = repeat('expanded significantly after update operation ', 100)
WHERE id BETWEEN 51 AND 100;
-- Update non-text column (counter)
UPDATE recno_cfull_upd SET counter = counter + 1;
-- Verify results
SELECT
    COUNT(*) FILTER (WHERE data = 'short') AS short_count,
    COUNT(*) FILTER (WHERE length(data) > 2000) AS long_count,
    COUNT(*) FILTER (WHERE length(data) BETWEEN 100 AND 2000) AS medium_count,
    COUNT(*) FILTER (WHERE counter = 1) AS updated_counter_count
FROM recno_cfull_upd;
 short_count | long_count | medium_count | updated_counter_count 
-------------+------------+--------------+-----------------------
          50 |         50 |          100 |                   200
(1 row)

-- Verify specific updated values
SELECT COUNT(*) AS short_mismatches
FROM recno_cfull_upd
WHERE id <= 50 AND data <> 'short';
 short_mismatches 
------------------
                0
(1 row)

SELECT COUNT(*) AS long_mismatches
FROM recno_cfull_upd
WHERE id BETWEEN 51 AND 100
  AND data <> repeat('expanded significantly after update operation ', 100);
 long_mismatches 
-----------------
               0
(1 row)

DROP TABLE recno_cfull_upd;
-- =============================================
-- 11. Compression with DELETE + VACUUM + re-insert
-- =============================================
SET recno_enable_compression = on;
CREATE TABLE recno_cfull_vac (
    id serial PRIMARY KEY,
    data text
) USING recno;
INSERT INTO recno_cfull_vac (data)
SELECT repeat('vacuum with compression ', 60)
FROM generate_series(1, 500);
-- Delete half the rows
DELETE FROM recno_cfull_vac WHERE id % 2 = 0;
SELECT COUNT(*) AS after_delete FROM recno_cfull_vac;
 after_delete 
--------------
          250
(1 row)

-- VACUUM to reclaim space
VACUUM recno_cfull_vac;
SELECT COUNT(*) AS after_vacuum FROM recno_cfull_vac;
 after_vacuum 
--------------
          250
(1 row)

-- Re-insert into reclaimed space
INSERT INTO recno_cfull_vac (data)
SELECT repeat('new data after vacuum and compression ', 60)
FROM generate_series(1, 250);
SELECT COUNT(*) AS after_reinsert FROM recno_cfull_vac;
 after_reinsert 
----------------
            500
(1 row)

-- Verify old rows survived correctly
SELECT COUNT(*) AS old_row_mismatches
FROM recno_cfull_vac
WHERE id <= 500 AND data <> repeat('vacuum with compression ', 60);
 old_row_mismatches 
--------------------
                  0
(1 row)

-- Verify new rows inserted correctly
SELECT COUNT(*) AS new_row_mismatches
FROM recno_cfull_vac
WHERE id > 500 AND data <> repeat('new data after vacuum and compression ', 60);
 new_row_mismatches 
--------------------
                  0
(1 row)

DROP TABLE recno_cfull_vac;
-- =============================================
-- 12. Compression with index scans
-- =============================================
SET recno_enable_compression = on;
CREATE TABLE recno_cfull_idx (
    id serial PRIMARY KEY,
    name text,
    payload text
) USING recno;
CREATE INDEX idx_cfull_name ON recno_cfull_idx (name);
INSERT INTO recno_cfull_idx (name, payload)
SELECT 'item_' || lpad(i::text, 5, '0'),
       repeat('indexed compressed payload data ', 40)
FROM generate_series(1, 1000) i;
-- Force index scan
SET enable_seqscan = off;
-- Point lookup via index
SELECT name, length(payload) AS payload_len
FROM recno_cfull_idx WHERE name = 'item_00500';
    name    | payload_len 
------------+-------------
 item_00500 |        1280
(1 row)

-- Range scan via index
SELECT COUNT(*), MIN(name), MAX(name)
FROM recno_cfull_idx WHERE name >= 'item_00100' AND name <= 'item_00200';
 count |    min     |    max     
-------+------------+------------
   101 | item_00100 | item_00200
(1 row)

-- Verify decompressed payload via index
SELECT COUNT(*) AS payload_mismatches
FROM recno_cfull_idx
WHERE name = 'item_00001'
  AND payload <> repeat('indexed compressed payload data ', 40);
 payload_mismatches 
--------------------
                  0
(1 row)

RESET enable_seqscan;
-- Update via index lookup
UPDATE recno_cfull_idx SET payload = repeat('updated payload ', 50) WHERE name = 'item_00500';
SET enable_seqscan = off;
SELECT name, length(payload) AS new_payload_len
FROM recno_cfull_idx WHERE name = 'item_00500';
    name    | new_payload_len 
------------+-----------------
 item_00500 |             800
(1 row)

RESET enable_seqscan;
DROP TABLE recno_cfull_idx;
-- =============================================
-- 13. Edge cases: empty, below-threshold, at-threshold
-- =============================================
SET recno_enable_compression = on;
CREATE TABLE recno_cfull_edge (
    id serial PRIMARY KEY,
    data text,
    bin bytea
) USING recno;
-- Empty string (should not compress)
INSERT INTO recno_cfull_edge (data, bin) VALUES ('', ''::bytea);
-- 1 byte (below RECNO_MIN_COMPRESS_SIZE=32)
INSERT INTO recno_cfull_edge (data, bin) VALUES ('x', '\x00'::bytea);
-- Exactly 31 bytes (just below threshold)
INSERT INTO recno_cfull_edge (data) VALUES (repeat('a', 31));
-- Exactly 32 bytes (at threshold)
INSERT INTO recno_cfull_edge (data) VALUES (repeat('b', 32));
-- Exactly 33 bytes (just above threshold)
INSERT INTO recno_cfull_edge (data) VALUES (repeat('c', 33));
-- Powers of 2
INSERT INTO recno_cfull_edge (data) VALUES (repeat('d', 64));
INSERT INTO recno_cfull_edge (data) VALUES (repeat('e', 128));
INSERT INTO recno_cfull_edge (data) VALUES (repeat('f', 256));
INSERT INTO recno_cfull_edge (data) VALUES (repeat('g', 512));
INSERT INTO recno_cfull_edge (data) VALUES (repeat('h', 1024));
INSERT INTO recno_cfull_edge (data) VALUES (repeat('i', 2048));
-- Verify all round-trip correctly
SELECT id, length(data) AS len, bin IS NULL AS bin_null
FROM recno_cfull_edge ORDER BY id;
 id | len  | bin_null 
----+------+----------
  1 |    0 | f
  2 |    1 | f
  3 |   31 | t
  4 |   32 | t
  5 |   33 | t
  6 |   64 | t
  7 |  128 | t
  8 |  256 | t
  9 |  512 | t
 10 | 1024 | t
 11 | 2048 | t
(11 rows)

-- Verify exact content
SELECT id,
    CASE
        WHEN id = 1 THEN data = ''
        WHEN id = 2 THEN data = 'x'
        WHEN id = 3 THEN data = repeat('a', 31)
        WHEN id = 4 THEN data = repeat('b', 32)
        WHEN id = 5 THEN data = repeat('c', 33)
        WHEN id = 6 THEN data = repeat('d', 64)
        WHEN id = 7 THEN data = repeat('e', 128)
        WHEN id = 8 THEN data = repeat('f', 256)
        WHEN id = 9 THEN data = repeat('g', 512)
        WHEN id = 10 THEN data = repeat('h', 1024)
        WHEN id = 11 THEN data = repeat('i', 2048)
        ELSE false
    END AS content_correct
FROM recno_cfull_edge ORDER BY id;
 id | content_correct 
----+-----------------
  1 | t
  2 | t
  3 | t
  4 | t
  5 | t
  6 | t
  7 | t
  8 | t
  9 | t
 10 | t
 11 | t
(11 rows)

DROP TABLE recno_cfull_edge;
-- =============================================
-- 14. Various data patterns
-- =============================================
SET recno_enable_compression = on;
CREATE TABLE recno_cfull_patterns (
    id serial PRIMARY KEY,
    ptype text,
    data text
) USING recno;
-- All zeros (maximally compressible)
INSERT INTO recno_cfull_patterns (ptype, data)
VALUES ('all_zeros', repeat('0', 10000));
-- Alternating pattern
INSERT INTO recno_cfull_patterns (ptype, data)
VALUES ('alternating', repeat('AB', 5000));
-- Incrementing CSV
INSERT INTO recno_cfull_patterns (ptype, data)
SELECT 'incrementing', string_agg(i::text, ',')
FROM generate_series(1, 2000) i;
-- English prose (moderate compressibility)
INSERT INTO recno_cfull_patterns (ptype, data)
VALUES ('english',
    repeat('The quick brown fox jumps over the lazy dog. Pack my box with five dozen liquor jugs. ', 100));
-- JSON structure
INSERT INTO recno_cfull_patterns (ptype, data)
SELECT 'json_like',
    '[' || string_agg('{"id":' || i || ',"v":"item_' || i || '"}', ',') || ']'
FROM generate_series(1, 500) i;
-- Nearly random hex
INSERT INTO recno_cfull_patterns (ptype, data)
SELECT 'random_hex', string_agg(md5(i::text), '')
FROM generate_series(1, 200) i;
-- Verify lengths
SELECT ptype, length(data) AS data_length
FROM recno_cfull_patterns ORDER BY ptype;
    ptype     | data_length 
--------------+-------------
 all_zeros    |       10000
 alternating  |       10000
 english      |        8600
 incrementing |        8892
 json_like    |       12785
 random_hex   |        6400
(6 rows)

-- Verify prefix/suffix integrity
SELECT ptype, left(data, 30) AS prefix, right(data, 30) AS suffix
FROM recno_cfull_patterns ORDER BY ptype;
    ptype     |             prefix             |             suffix             
--------------+--------------------------------+--------------------------------
 all_zeros    | 000000000000000000000000000000 | 000000000000000000000000000000
 alternating  | ABABABABABABABABABABABABABABAB | ABABABABABABABABABABABABABABAB
 english      | The quick brown fox jumps over |  with five dozen liquor jugs. 
 incrementing | 1,2,3,4,5,6,7,8,9,10,11,12,13, | ,1995,1996,1997,1998,1999,2000
 json_like    | [{"id":1,"v":"item_1"},{"id":2 | 9"},{"id":500,"v":"item_500"}]
 random_hex   | c4ca4238a0b923820dcc509a6f7584 | 44a684f98ea8fe223c713b77189a77
(6 rows)

-- Verify specific patterns
SELECT ptype,
    CASE ptype
        WHEN 'all_zeros' THEN data = repeat('0', 10000)
        WHEN 'alternating' THEN data = repeat('AB', 5000)
        ELSE true  -- other patterns are generated, just check they exist
    END AS pattern_correct
FROM recno_cfull_patterns ORDER BY ptype;
    ptype     | pattern_correct 
--------------+-----------------
 all_zeros    | t
 alternating  | t
 english      | t
 incrementing | t
 json_like    | t
 random_hex   | t
(6 rows)

DROP TABLE recno_cfull_patterns;
-- =============================================
-- 15. Concurrent compression toggle mid-session
-- =============================================
SET recno_enable_compression = on;
CREATE TABLE recno_cfull_toggle (
    id serial PRIMARY KEY,
    data text
) USING recno;
-- Insert with compression on
INSERT INTO recno_cfull_toggle (data)
SELECT repeat('compressed row ', 60)
FROM generate_series(1, 100);
-- Turn compression off mid-session
SET recno_enable_compression = off;
-- Insert without compression into same table
INSERT INTO recno_cfull_toggle (data)
SELECT repeat('uncompressed row ', 60)
FROM generate_series(1, 100);
-- Turn compression back on
SET recno_enable_compression = on;
-- Insert more compressed rows
INSERT INTO recno_cfull_toggle (data)
SELECT repeat('compressed again ', 60)
FROM generate_series(1, 100);
-- All 300 rows must be readable regardless of how they were stored
SELECT COUNT(*) AS total FROM recno_cfull_toggle;
 total 
-------
   300
(1 row)

SELECT
    COUNT(*) FILTER (WHERE data = repeat('compressed row ', 60)) AS comp_ok,
    COUNT(*) FILTER (WHERE data = repeat('uncompressed row ', 60)) AS uncomp_ok,
    COUNT(*) FILTER (WHERE data = repeat('compressed again ', 60)) AS recomp_ok
FROM recno_cfull_toggle;
 comp_ok | uncomp_ok | recomp_ok 
---------+-----------+-----------
     100 |       100 |       100
(1 row)

DROP TABLE recno_cfull_toggle;
-- =============================================
-- Cleanup
-- =============================================
RESET recno_enable_compression;
RESET recno_compression_algorithm;
RESET recno_compression_level;
