--
-- Test RECNO parallel scanning and TID range scan support
--
-- =============================================
-- Setup - Enable parallel query
-- =============================================
-- Suppress non-deterministic resource leak warnings (memory addresses vary)
SET client_min_messages = error;
-- Force parallel query for testing
SET max_parallel_workers_per_gather = 2;
SET parallel_tuple_cost = 0;
SET parallel_setup_cost = 0;
SET min_parallel_table_scan_size = 0;
SET min_parallel_index_scan_size = 0;
-- =============================================
-- Create and populate a RECNO table
-- =============================================
CREATE TABLE recno_parallel_test (
    id integer NOT NULL,
    val text,
    num numeric
) USING recno;
-- Insert enough rows to make parallel scan worthwhile
INSERT INTO recno_parallel_test
SELECT i, 'row_' || i::text, (i * 1.5)::numeric
FROM generate_series(1, 1000) AS i;
-- Verify row count
SELECT COUNT(*) FROM recno_parallel_test;
 count 
-------
  1000
(1 row)

-- =============================================
-- TID range scan tests
-- =============================================
-- Basic TID range scan using ctid
SELECT COUNT(*) FROM recno_parallel_test WHERE ctid >= '(0,1)' AND ctid < '(0,10)';
 count 
-------
    27
(1 row)

-- TID range scan should return tuples in range
SELECT id FROM recno_parallel_test WHERE ctid >= '(0,1)' AND ctid <= '(0,5)' ORDER BY id;
 id 
----
  1
  1
  1
  2
  2
  2
  3
  3
  3
  4
  4
  4
  5
  5
  5
(15 rows)

-- Empty TID range should return no rows
SELECT COUNT(*) FROM recno_parallel_test WHERE ctid >= '(9999,1)' AND ctid < '(9999,10)';
 count 
-------
     0
(1 row)

-- TID range scan with only lower bound
SELECT COUNT(*) > 0 AS has_rows FROM recno_parallel_test WHERE ctid >= '(0,1)';
 has_rows 
----------
 t
(1 row)

-- TID range scan with only upper bound
SELECT COUNT(*) > 0 AS has_rows FROM recno_parallel_test WHERE ctid < '(1,1)';
 has_rows 
----------
 f
(1 row)

-- =============================================
-- Parallel sequential scan tests
-- =============================================
-- Force parallel execution and verify results are correct
-- The aggregate should produce the same result regardless of parallelism
-- Sum with parallel scan
SET enable_seqscan = on;
SET enable_indexscan = off;
SET enable_bitmapscan = off;
SELECT SUM(id) AS total_id FROM recno_parallel_test;
 total_id 
----------
   500500
(1 row)

-- Verify the sum is correct: sum(1..1000) = 500500
SELECT SUM(id) = 500500 AS sum_correct FROM recno_parallel_test;
 sum_correct 
-------------
 t
(1 row)

-- Count with parallel scan
SELECT COUNT(*) = 1000 AS count_correct FROM recno_parallel_test;
 count_correct 
---------------
 t
(1 row)

-- Min/Max with parallel scan
SELECT MIN(id) = 1 AS min_correct, MAX(id) = 1000 AS max_correct
FROM recno_parallel_test;
 min_correct | max_correct 
-------------+-------------
 t           | t
(1 row)

-- =============================================
-- Parallel scan with WHERE clause
-- =============================================
SELECT COUNT(*) FROM recno_parallel_test WHERE id > 500;
 count 
-------
   500
(1 row)

SELECT COUNT(*) FROM recno_parallel_test WHERE id BETWEEN 100 AND 200;
 count 
-------
   101
(1 row)

SELECT COUNT(*) FROM recno_parallel_test WHERE val LIKE 'row_1%';
 count 
-------
   112
(1 row)

-- =============================================
-- Parallel scan with aggregation
-- =============================================
SELECT id % 10 AS bucket, COUNT(*) AS cnt
FROM recno_parallel_test
GROUP BY id % 10
ORDER BY bucket;
 bucket | cnt 
--------+-----
      0 | 100
      1 | 100
      2 | 100
      3 | 100
      4 | 100
      5 | 100
      6 | 100
      7 | 100
      8 | 100
      9 | 100
(10 rows)

-- =============================================
-- Parallel scan after modifications
-- =============================================
-- Delete some rows and verify parallel scan still works
DELETE FROM recno_parallel_test WHERE id <= 100;
SELECT COUNT(*) = 900 AS count_after_delete FROM recno_parallel_test;
 count_after_delete 
--------------------
 t
(1 row)

-- Update some rows and verify
UPDATE recno_parallel_test SET val = 'updated_' || id::text WHERE id <= 200;
ERROR:  updated recno tuple does not fit on page
DETAIL:  The updated row is larger than its current slot, all variable-length columns are already stored off-page, and the page has no free space.
HINT:  RECNO tuples have stable TIDs and cannot move to another page. Lower the table's fillfactor to reserve room for in-place growth.
SELECT COUNT(*) FROM recno_parallel_test WHERE val LIKE 'updated_%';
 count 
-------
     0
(1 row)

-- =============================================
-- Parallel scan on empty table
-- =============================================
CREATE TABLE recno_parallel_empty (
    id integer,
    val text
) USING recno;
SELECT COUNT(*) = 0 AS empty_correct FROM recno_parallel_empty;
 empty_correct 
---------------
 t
(1 row)

DROP TABLE recno_parallel_empty;
-- =============================================
-- Verify parallel plan generation
-- =============================================
-- Check that EXPLAIN shows parallel workers for large enough table
EXPLAIN (COSTS OFF) SELECT COUNT(*) FROM recno_parallel_test;
                         QUERY PLAN                         
------------------------------------------------------------
 Finalize Aggregate
   ->  Gather
         Workers Planned: 2
         ->  Partial Aggregate
               ->  Parallel Seq Scan on recno_parallel_test
(5 rows)

-- =============================================
-- Compare parallel vs serial results
-- =============================================
-- Get results with parallel disabled
SET max_parallel_workers_per_gather = 0;
SELECT SUM(id) AS serial_sum, COUNT(*) AS serial_count
FROM recno_parallel_test;
 serial_sum | serial_count 
------------+--------------
     495450 |          900
(1 row)

-- Get results with parallel enabled
SET max_parallel_workers_per_gather = 2;
SELECT SUM(id) AS parallel_sum, COUNT(*) AS parallel_count
FROM recno_parallel_test;
 parallel_sum | parallel_count 
--------------+----------------
       495450 |            900
(1 row)

-- The results should be identical (verified by the test framework
-- comparing .out files)
-- =============================================
-- Cleanup
-- =============================================
RESET max_parallel_workers_per_gather;
RESET parallel_tuple_cost;
RESET parallel_setup_cost;
RESET min_parallel_table_scan_size;
RESET min_parallel_index_scan_size;
RESET enable_seqscan;
RESET enable_indexscan;
RESET enable_bitmapscan;
DROP TABLE recno_parallel_test;
