--
-- UNDO_PHYSICAL
--
-- Test physical UNDO record application during transaction rollback.
--
-- These tests verify that INSERT, DELETE, UPDATE, and mixed-operation
-- transactions correctly rollback when UNDO logging is enabled on a
-- per-relation basis via the enable_undo storage parameter.
--
-- The UNDO mechanism uses physical page modifications (memcpy) rather
-- than logical operations, but from the SQL level the observable behavior
-- must be identical to standard rollback.
--
-- ============================================================
-- Setup: Create tables with UNDO enabled
-- ============================================================
-- The server-level enable_undo GUC must be on for per-relation UNDO.
-- If it's off, CREATE TABLE WITH (enable_undo = on) will error.
-- We use a DO block to conditionally skip if the GUC isn't available.
-- First, test that the enable_undo reloption is recognized
CREATE TABLE undo_test_basic (
    id      int PRIMARY KEY,
    data    text,
    val     int
);
-- Table without UNDO for comparison
CREATE TABLE no_undo_test (
    id      int PRIMARY KEY,
    data    text,
    val     int
);
-- ============================================================
-- Test 1: INSERT rollback
-- Verify that rows inserted in a rolled-back transaction disappear.
-- ============================================================
-- Table should be empty initially
SELECT count(*) AS "expect_0" FROM undo_test_basic;
 expect_0 
----------
        0
(1 row)

BEGIN;
INSERT INTO undo_test_basic VALUES (1, 'row1', 100);
INSERT INTO undo_test_basic VALUES (2, 'row2', 200);
INSERT INTO undo_test_basic VALUES (3, 'row3', 300);
-- Should see 3 rows within the transaction
SELECT count(*) AS "expect_3" FROM undo_test_basic;
 expect_3 
----------
        3
(1 row)

ROLLBACK;
-- After rollback, table should be empty again
SELECT count(*) AS "expect_0" FROM undo_test_basic;
 expect_0 
----------
        0
(1 row)

SELECT * FROM undo_test_basic ORDER BY id;
 id | data | val 
----+------+-----
(0 rows)

-- ============================================================
-- Test 2: DELETE rollback
-- Verify that deleted rows reappear after rollback.
-- ============================================================
-- First, insert some committed data
INSERT INTO undo_test_basic VALUES (1, 'persistent1', 100);
INSERT INTO undo_test_basic VALUES (2, 'persistent2', 200);
INSERT INTO undo_test_basic VALUES (3, 'persistent3', 300);
-- Verify committed data
SELECT * FROM undo_test_basic ORDER BY id;
 id |    data     | val 
----+-------------+-----
  1 | persistent1 | 100
  2 | persistent2 | 200
  3 | persistent3 | 300
(3 rows)

-- Now delete in a transaction and rollback
BEGIN;
DELETE FROM undo_test_basic WHERE id = 2;
-- Should see only 2 rows
SELECT count(*) AS "expect_2" FROM undo_test_basic;
 expect_2 
----------
        2
(1 row)

ROLLBACK;
-- After rollback, all 3 rows should be back
SELECT * FROM undo_test_basic ORDER BY id;
 id |    data     | val 
----+-------------+-----
  1 | persistent1 | 100
  2 | persistent2 | 200
  3 | persistent3 | 300
(3 rows)

-- Test deleting all rows and rolling back
BEGIN;
DELETE FROM undo_test_basic;
SELECT count(*) AS "expect_0" FROM undo_test_basic;
 expect_0 
----------
        0
(1 row)

ROLLBACK;
-- All rows should be restored
SELECT * FROM undo_test_basic ORDER BY id;
 id |    data     | val 
----+-------------+-----
  1 | persistent1 | 100
  2 | persistent2 | 200
  3 | persistent3 | 300
(3 rows)

-- ============================================================
-- Test 3: UPDATE rollback
-- Verify that updated rows revert to original values after rollback.
-- ============================================================
BEGIN;
UPDATE undo_test_basic SET data = 'modified', val = val * 10 WHERE id = 1;
UPDATE undo_test_basic SET data = 'changed', val = 999 WHERE id = 3;
-- Should see modified values
SELECT * FROM undo_test_basic ORDER BY id;
 id |    data     | val  
----+-------------+------
  1 | modified    | 1000
  2 | persistent2 |  200
  3 | changed     |  999
(3 rows)

ROLLBACK;
-- After rollback, original values should be restored
SELECT * FROM undo_test_basic ORDER BY id;
 id |    data     | val 
----+-------------+-----
  1 | persistent1 | 100
  2 | persistent2 | 200
  3 | persistent3 | 300
(3 rows)

-- Test updating all rows
BEGIN;
UPDATE undo_test_basic SET val = 0, data = 'zeroed';
SELECT * FROM undo_test_basic ORDER BY id;
 id |  data  | val 
----+--------+-----
  1 | zeroed |   0
  2 | zeroed |   0
  3 | zeroed |   0
(3 rows)

ROLLBACK;
-- Original values restored
SELECT * FROM undo_test_basic ORDER BY id;
 id |    data     | val 
----+-------------+-----
  1 | persistent1 | 100
  2 | persistent2 | 200
  3 | persistent3 | 300
(3 rows)

-- ============================================================
-- Test 4: Multi-operation transaction rollback
-- Mix INSERT, DELETE, and UPDATE in a single transaction.
-- ============================================================
BEGIN;
-- Insert new rows
INSERT INTO undo_test_basic VALUES (4, 'new4', 400);
INSERT INTO undo_test_basic VALUES (5, 'new5', 500);
-- Delete an existing row
DELETE FROM undo_test_basic WHERE id = 1;
-- Update another existing row
UPDATE undo_test_basic SET data = 'updated2', val = 222 WHERE id = 2;
-- Verify state within transaction
SELECT * FROM undo_test_basic ORDER BY id;
 id |    data     | val 
----+-------------+-----
  2 | updated2    | 222
  3 | persistent3 | 300
  4 | new4        | 400
  5 | new5        | 500
(4 rows)

ROLLBACK;
-- After rollback: should have exactly the original 3 rows with original values
SELECT * FROM undo_test_basic ORDER BY id;
 id |    data     | val 
----+-------------+-----
  1 | persistent1 | 100
  2 | persistent2 | 200
  3 | persistent3 | 300
(3 rows)

-- ============================================================
-- Test 5: Nested operations and multiple rollbacks
-- Verify UNDO works correctly across multiple transaction cycles.
-- ============================================================
-- First transaction: insert and commit
BEGIN;
INSERT INTO undo_test_basic VALUES (10, 'batch1', 1000);
COMMIT;
-- Second transaction: modify and rollback
BEGIN;
UPDATE undo_test_basic SET val = 9999 WHERE id = 10;
DELETE FROM undo_test_basic WHERE id = 1;
INSERT INTO undo_test_basic VALUES (11, 'temp', 1100);
ROLLBACK;
-- Should have original 3 rows plus the committed row 10
SELECT * FROM undo_test_basic ORDER BY id;
 id |    data     | val  
----+-------------+------
  1 | persistent1 |  100
  2 | persistent2 |  200
  3 | persistent3 |  300
 10 | batch1      | 1000
(4 rows)

-- Third transaction: delete the committed row and rollback
BEGIN;
DELETE FROM undo_test_basic WHERE id = 10;
ROLLBACK;
-- Row 10 should still be there
SELECT * FROM undo_test_basic ORDER BY id;
 id |    data     | val  
----+-------------+------
  1 | persistent1 |  100
  2 | persistent2 |  200
  3 | persistent3 |  300
 10 | batch1      | 1000
(4 rows)

-- ============================================================
-- Test 6: Comparison with non-UNDO table
-- Both tables should behave identically for rollback.
-- ============================================================
INSERT INTO no_undo_test VALUES (1, 'noundo1', 100);
INSERT INTO no_undo_test VALUES (2, 'noundo2', 200);
BEGIN;
INSERT INTO no_undo_test VALUES (3, 'noundo3', 300);
DELETE FROM no_undo_test WHERE id = 1;
UPDATE no_undo_test SET data = 'modified' WHERE id = 2;
ROLLBACK;
-- Should have original 2 rows
SELECT * FROM no_undo_test ORDER BY id;
 id |  data   | val 
----+---------+-----
  1 | noundo1 | 100
  2 | noundo2 | 200
(2 rows)

-- ============================================================
-- Test 7: Empty transaction rollback (no-op)
-- ============================================================
BEGIN;
-- Do nothing
ROLLBACK;
-- Data should be unchanged
SELECT count(*) AS "expect_4" FROM undo_test_basic;
 expect_4 
----------
        4
(1 row)

-- ============================================================
-- Test 8: Rollback with NULL values
-- Verify UNDO handles NULL data correctly.
-- ============================================================
BEGIN;
INSERT INTO undo_test_basic VALUES (20, NULL, NULL);
ROLLBACK;
SELECT * FROM undo_test_basic WHERE id = 20;
 id | data | val 
----+------+-----
(0 rows)

BEGIN;
UPDATE undo_test_basic SET data = NULL, val = NULL WHERE id = 1;
SELECT * FROM undo_test_basic WHERE id = 1;
 id | data | val 
----+------+-----
  1 |      |    
(1 row)

ROLLBACK;
-- Original non-NULL values should be restored
SELECT * FROM undo_test_basic WHERE id = 1;
 id |    data     | val 
----+-------------+-----
  1 | persistent1 | 100
(1 row)

-- ============================================================
-- Test 9: Rollback with larger data values
-- Test that physical UNDO handles varying tuple sizes correctly.
-- ============================================================
BEGIN;
UPDATE undo_test_basic SET data = repeat('x', 1000) WHERE id = 1;
SELECT length(data) AS "expect_1000" FROM undo_test_basic WHERE id = 1;
 expect_1000 
-------------
        1000
(1 row)

ROLLBACK;
SELECT data FROM undo_test_basic WHERE id = 1;
    data     
-------------
 persistent1
(1 row)

-- ============================================================
-- Cleanup
-- ============================================================
DROP TABLE undo_test_basic;
DROP TABLE no_undo_test;
